Enhancer_ID	Gene_geneID	EnhancerDistance	PROseq_Classification	pair_score	UNIPROTname	geneFunc	geneName	geneFuncFullText
Region5209	FBgn0010313	44765	Toll10b Down	-5.29551632035696	P41046	Centrosomal and chromosomal factor	corto	<ul><li>Essential protein required for proper condensation of mitotic chromosomes and progression through mitosis (PubMed:9463384). Binds to specific polytene chromosome sites, many of which are shared with the posterior sex combs (Psc) protein (PubMed:9463384). Involved in maintaining Abd-B repression outside its normal expression domain (PubMed:18667003, PubMed:18286205).</ul>
Region5220	FBgn0010313	3358	Toll10b Down	-6.3218311696015	P41046	Centrosomal and chromosomal factor	corto	<ul><li>Essential protein required for proper condensation of mitotic chromosomes and progression through mitosis (PubMed:9463384). Binds to specific polytene chromosome sites, many of which are shared with the posterior sex combs (Psc) protein (PubMed:9463384). Involved in maintaining Abd-B repression outside its normal expression domain (PubMed:18667003, PubMed:18286205).</ul>
Region5220	FBgn0010313	3358	Toll10b Down	-6.11655017386335	P41046	Centrosomal and chromosomal factor	corto	<ul><li>Essential protein required for proper condensation of mitotic chromosomes and progression through mitosis (PubMed:9463384). Binds to specific polytene chromosome sites, many of which are shared with the posterior sex combs (Psc) protein (PubMed:9463384). Involved in maintaining Abd-B repression outside its normal expression domain (PubMed:18667003, PubMed:18286205).</ul>
Region5692	FBgn0001235	13236	Toll9 Up	6.78746535889284	O46339	Homeobox protein homothorax	hth	<ul><li>All isoforms are required for patterning of the embryonic cuticle. Acts with exd to delimit the eye field and prevent inappropriate eye development. Isoforms that carry the homeodomain are required for proper localization of chordotonal organs within the peripheral nervous system and antennal identity; required to activate antennal-specific genes, such as sal and to repress the leg-like expression of dac. Necessary for the nuclear localization of the essential HOX cofactor, extradenticle (exd). Both necessary and sufficient for inner photoreceptors to adopt the polarization-sensitive 'dorsal rim area' (DRA) of the eye fate instead of the color-sensitive default state. This occurs by increasing rhabdomere size and uncoupling R7-R8 communication to allow both cells to express the same opsin rather than different ones as required for color vision.</ul>
Region5692	FBgn0001235	13236	Toll9 Up	6.20464056960392	O46339	Homeobox protein homothorax	hth	<ul><li>All isoforms are required for patterning of the embryonic cuticle. Acts with exd to delimit the eye field and prevent inappropriate eye development. Isoforms that carry the homeodomain are required for proper localization of chordotonal organs within the peripheral nervous system and antennal identity; required to activate antennal-specific genes, such as sal and to repress the leg-like expression of dac. Necessary for the nuclear localization of the essential HOX cofactor, extradenticle (exd). Both necessary and sufficient for inner photoreceptors to adopt the polarization-sensitive 'dorsal rim area' (DRA) of the eye fate instead of the color-sensitive default state. This occurs by increasing rhabdomere size and uncoupling R7-R8 communication to allow both cells to express the same opsin rather than different ones as required for color vision.</ul>
Region6184	FBgn0000014	20465	Toll9 Up	5.06179264485568	P29555	Homeobox protein abdominal-A	abd-A	<ul><li>Sequence-specific transcription factor which is part of a developmental regulatory system that provides cells with specific positional identities on the anterior-posterior axis. Required for segmental identity of the second through eighth abdominal segments. Once a pattern of abd-A expression is turned on in a given parasegment, it remains on the more posterior parasegment, so that the complex pattern of expression is built up in the successive parasegments. Appears to repress expression of Ubx whenever they appear in the same cell, but abd-A is repressed by Abd-B only in the eight and ninth abdominal segments.</ul>
Region6372	FBgn0000463	13329	Toll9 Up	3.72092773445073	P10041	Neurogenic locus protein delta	Dl	<ul><li>Acts as a ligand for Notch (N) receptor. Essential for proper differentiation of ectoderm. Dl is required for the correct separation of neural and epidermal cell lineages. Fringe (fng) acts in the Golgi to determine the type of O-linked fucose on the EGF modules in N, altering the ability of N to bind with Delta (Dl). O-fut1 also has a role in modulating the interaction.</ul>
Region6373	FBgn0000463	15062	Toll9 Up	6.47264702622314	P10041	Neurogenic locus protein delta	Dl	<ul><li>Acts as a ligand for Notch (N) receptor. Essential for proper differentiation of ectoderm. Dl is required for the correct separation of neural and epidermal cell lineages. Fringe (fng) acts in the Golgi to determine the type of O-linked fucose on the EGF modules in N, altering the ability of N to bind with Delta (Dl). O-fut1 also has a role in modulating the interaction.</ul>
Region7142	FBgn0002413	2824	Time Up	2.86619125679934	O76324	Discs overgrown protein kinase	dco	<ul><li>Involved in circadian rhythms, viability and molecular oscillations of the clock genes period (per) and timeless (tim). Dbt reduces the stability and thus the accumulation of monomeric per proteins, probably through phosphorylation. No evident circadian oscillation is detected in head. Together with CkIalpha, regulates processing of ci by phosphorylating it which promotes its binding to slmb, the F-box recognition component of the SCF(slmb) E3 ubiquitin-protein ligase (PubMed:16326393).</ul>
Region8030	FBgn0046687	3795	Toll9 Up	2.45904167624146	Q9NDM2	Protein trapped in endoderm-1	Tre1	<ul><li>Essential for the first active step of germ cell migration: transepithelial migration of germ cells through the posterior midgut (PMG) epithelium.</ul>
Region8247	FBgn0004657	2003	Time Up	3.99251681733394	P11584	Integrin beta-PS	mys	<ul><li>Integrin alpha-PS1/beta-PS is a receptor for laminin (PubMed:7972082). Integrin alpha-PS2/beta-PS is a receptor for Tig, wb and Ten-m (PubMed:7924982, PubMed:7972082, PubMed:9660786). Contributes to endodermal integrity and adhesion between the midgut epithelium and the surrounding visceral muscle (PubMed:15469969). Essential for migration of the primordial midgut cells and for maintaining, but not establishing, cell polarity in the midgut epithelium (PubMed:15469969). The two beta subunits mediate midgut migration by distinct mechanisms: beta-PS requires rhea/talin and Itgbn does not (PubMed:15469969). Required for rhea/talin correct cellular localization in the midgut (PubMed:15469969). Required for many embryonic (dorsal closure and somatic muscle attachments) and postembryonic developmental processes (attachment between cell layers of imaginal disks, organization of ommatidial arrays and flight muscle development) (PubMed:8119134, PubMed:7924982, PubMed:7972082, PubMed:10821184). Involved in the function and/or development of the olfactory system (PubMed:10821184). In the testes, essential for shv-dependent maintenance of somatic hub cells and their localization to the apical tip (PubMed:27191715). Plays a role in timely border cell migration during oogenesis (PubMed:19035354).</ul>
Region8288	FBgn0264975	14336	Time Up	3.32721261593957	P20241	Neuroglian	Nrg	<ul><li>The long isoform may play a role in neural and glial cell adhesion in the developing embryo. The short isoform may be a more general cell adhesion molecule involved in other tissues and imaginal disk morphogenesis. Vital for embryonic development. Essential for septate junctions. Septate junctions, which are the equivalent of vertebrates tight junctions, are characterized by regular arrays of transverse structures that span the intermembrane space and form a physical barrier to diffusion. Required for the blood-brain barrier formation.</ul>
Region9121	FBgn0030974	37441	Time Down	-3.84190794211812	Q9VWN4	Fl(2)d-associated complex component	Flacc	<ul><li>Associated component of the WMM complex, a complex that mediates N6-methyladenosine (m6A) methylation of mRNAs, a modification that plays a role in the efficiency of mRNA splicing and is required for sex determination (PubMed:29535189, PubMed:29555755). In the WMM complex, acts as a key regulator of m6A methylation by bridging fl(2)d to the RNA-binding component nito (PubMed:29535189). Required for sex determination and dosage compensation via Sxl alternative splicing: m6A methylation acts as a key regulator of Sxl pre-mRNA and promotes female-specific alternative splicing of Sxl, which determines female physiognomy (PubMed:29535189, PubMed:29555755).</ul>
